{
  "schema_version": "1.0",
  "config_id": "simulated-site-startup-form",
  "version": 4,
  "status": "enabled",
  "form_type": "site-startup-form",
  "created_at": "2026-08-13T14:07:59.008797+00:00",
  "template": {
    "file_name": "模拟项目启动信息表.xlsx",
    "sha256": "605f36402efe2959572a085018692cb72661f9f28a193e5efb660c1dd94f35c2",
    "structure_fingerprint": "588a79e0be1fd265f808e5e82b4da8e7c19dfb899b29797527d1d5629344fe44",
    "format": "xlsx"
  },
  "fields": [
    {
      "id": "project_name",
      "label": "项目名称",
      "fact_key": "方案名称",
      "target": {
        "sheet": "申请信息",
        "cell": "B3",
        "expected_original": ""
      },
      "mapping": {
        "type": "direct",
        "mode": "cell"
      },
      "mapping_review": "approved",
      "source_hint": {
        "source_file": "project-info.xlsx",
        "source_location": "伦理审查申请表信息!B6"
      }
    },
    {
      "id": "protocol_number",
      "label": "方案编号",
      "fact_key": "方案编号",
      "target": {
        "sheet": "申请信息",
        "cell": "B4",
        "expected_original": ""
      },
      "mapping": {
        "type": "direct",
        "mode": "cell"
      },
      "mapping_review": "approved",
      "source_hint": {
        "source_file": "project-info.xlsx",
        "source_location": "伦理审查申请表信息!B4"
      }
    },
    {
      "id": "protocol_version",
      "label": "方案版本号",
      "fact_key": "方案版本号",
      "target": {
        "sheet": "申请信息",
        "cell": "B5",
        "expected_original": ""
      },
      "mapping": {
        "type": "direct",
        "mode": "cell"
      },
      "mapping_review": "approved",
      "source_hint": {
        "source_file": "project-info.xlsx",
        "source_location": "伦理审查申请表信息!B5"
      }
    },
    {
      "id": "funding_source",
      "label": "经费来源",
      "fact_key": "经费来源",
      "target": {
        "sheet": "申请信息",
        "cell": "B6",
        "expected_original": ""
      },
      "mapping": {
        "type": "direct",
        "mode": "cell"
      },
      "mapping_review": "approved",
      "source_hint": {
        "source_file": "project-info.xlsx",
        "source_location": "伦理审查申请表信息!B15"
      }
    },
    {
      "id": "acceptance_number",
      "label": "项目受理号",
      "fact_key": "项目受理号",
      "target": {
        "sheet": "申请信息",
        "cell": "B7",
        "expected_original": ""
      },
      "mapping": {
        "type": "direct",
        "mode": "cell"
      },
      "mapping_review": "approved",
      "source_hint": {
        "source_file": "project-info.xlsx",
        "source_location": "伦理审查申请表信息!B3"
      }
    },
    {
      "id": "department",
      "label": "研究科室",
      "fact_key": "研究科室",
      "target": {
        "sheet": "中心信息",
        "cell": "B3",
        "expected_original": ""
      },
      "mapping": {
        "type": "direct",
        "mode": "cell"
      },
      "mapping_review": "approved",
      "source_hint": {
        "source_file": "project-info.xlsx",
        "source_location": "伦理审查申请表信息!B8"
      }
    },
    {
      "id": "principal_investigator",
      "label": "主要研究者",
      "fact_key": "主要研究者",
      "target": {
        "sheet": "中心信息",
        "cell": "B4",
        "expected_original": ""
      },
      "mapping": {
        "type": "direct",
        "mode": "cell"
      },
      "mapping_review": "approved",
      "source_hint": {
        "source_file": "project-info.xlsx",
        "source_location": "伦理审查申请表信息!B7"
      }
    },
    {
      "id": "pi_signature",
      "label": "主要研究者签名",
      "fact_key": null,
      "target": {
        "sheet": "中心信息",
        "cell": "B5",
        "expected_original": ""
      },
      "mapping": {
        "type": "manual"
      },
      "mapping_review": "approved",
      "source_hint": null
    }
  ],
  "approval": {
    "approved_by": "CRA（用户确认）",
    "approved_at": "2026-08-15T12:58:07.616790+00:00",
    "approval_id": "CRA-EXCEL-V4-20260815"
  },
  "enabled_at": "2026-08-15T12:58:07.616790+00:00"
}
